{
  "schemaVersion": 1,
  "id": "com.example.plugins.demo_source",
  "name": "Demo Source",
  "description": "Same manifest as demo_source, in a directory with the wrong name.",
  "version": "1.0.0",
  "author": { "name": "Example Co" },
  "license": "Apache-2.0",
  "swayvePluginApi": 1,
  "minimumSwayveVersion": "0.1.0",
  "runtime": "compiled",
  "platforms": ["android"],
  "capabilities": ["search"],
  "permissions": ["network"],
  "entrypoint": "demo_source",
  "network": { "hosts": ["api.example.com"] }
}
